{
  "eventId": "019bd4b7-6e42-7a19-8c37-9d0e1f2a3b4c",
  "occurredAt": "2026-09-09T05:41:03.2660000+00:00",
  "aggregateId": "019bd18c-2a73-7e05-9f14-7a8b9c0d1e2f",
  "organisationId": "019bcf7f-9d10-7b21-84c6-5e7f8a9b0c1d",
  "versionNumber": 3,
  "eventType": "catalog.catalog-version-retired.v1",
  "schemaVersion": 1
}
